<?xml version="1.0" encoding="UTF-8"?>
<!DOCTYPE oval PUBLIC 
   "-//OVal/OVal Configuration DTD 1.3//EN"
   "http://oval.sourceforge.net/oval-configuration-1.3.dtd">
<oval>
	<!-- define a constraint set -->
	<constraintSet id="user.userid">
		<notNull message="{context} is null" />
		<matchPattern message="{context} does not match the pattern {pattern}">
			<pattern pattern="^[a-z0-9]{8}$" flags="0" />
		</matchPattern>
	</constraintSet>

	<!-- define checks for the net.sf.oval.test.enforcer.XMLConfigurationTest$User class -->
	<!-- overwrite=false means already defined checks for this class will not be removed -->
	<class type="net.sf.oval.test.guard.XMLConfigurationTest$User" overwrite="false"
		applyFieldConstraintsToSetters="true">
		<field name="firstName">
			<length min="0" max="3" message="{context} is not between {min} and {max} characters long" />
		</field>

		<field name="lastName">
			<length min="0" max="5" message="{context} is not between {min} and {max} characters long" />
		</field>

		<!-- overwrite=true means previously defined checks for this field will be overwritten by the checks defined here -->
		<field name="userId" overwrite="true">
			<!-- use the checks defined for the constaint set "user.userid" -->
			<assertConstraintSet id="user.userid" />
		</field>

		<!-- define constructor parameter checks -->
		<constructor>
			<!-- parameter 1 -->
			<parameter type="java.lang.String">
				<assertConstraintSet id="user.userid" />
			</parameter>

			<!-- parameter 2 -->
			<parameter type="java.lang.String">
				<assertConstraintSet id="user.userid" />
			</parameter>

			<!-- parameter 3 -->
			<!-- the types of all parameters must be listed, even if no checks are defined -->
			<parameter type="int" />
		</constructor>

		<!-- define a getter return value check -->
		<method name="getManagerId">
			<!-- returnValue -  use the checks defined for the constaint set "user.userid" -->
			<returnValue>
				<assertConstraintSet id="user.userid" />
			</returnValue>
		</method>

		<!-- define method parameter checks -->
		<method name="setManagerId">
			<!-- parameter 1 -->
			<parameter type="java.lang.String">
				<assertConstraintSet id="user.userid" />
			</parameter>
		</method>
	</class>
</oval>